{
  "schema_version": "0.1",
  "id": "plan-sso-001",
  "revision": 3,
  "digest": "8bb7027a0c7581f5b6eff392a0121736019980f565229b1c1d849ecd415912f7",
  "objective": "Add enterprise SSO to the payments service.",
  "subject": {
    "repository": "acme/payments",
    "revision": "rev-b"
  },
  "budget_envelope": {
    "max_child_runs": 8,
    "max_concurrency": 3,
    "max_provider_invocations": 24,
    "max_wall_seconds": 21600
  },
  "stages": [
    {
      "id": "architecture",
      "kind": "agent",
      "role": "system_architect",
      "objective": "State the SSO integration boundary and the modules it touches.",
      "requires_capabilities": [
        "architecture_reasoning",
        "repository_analysis"
      ],
      "invocation_mode": "mutating",
      "budget": {
        "max_execution_attempts": 2,
        "max_wall_seconds": 3600
      },
      "rationale": "The change crosses an authentication boundary, so the integration shape is decided before code is written."
    },
    {
      "id": "implementation",
      "kind": "agent",
      "role": "implementer",
      "objective": "Implement the SSO endpoints and session exchange.",
      "depends_on": [
        "architecture"
      ],
      "requires_capabilities": [
        "code_change",
        "repository_analysis"
      ],
      "invocation_mode": "mutating",
      "budget": {
        "max_execution_attempts": 2,
        "max_wall_seconds": 5400
      }
    },
    {
      "id": "security-review",
      "kind": "agent",
      "role": "security_reviewer",
      "objective": "Review the candidate for authentication and session defects.",
      "depends_on": [
        "implementation"
      ],
      "requires_capabilities": [
        "security_review"
      ],
      "independence": {
        "dimension": "vendor_family",
        "different_from": [
          "implementation"
        ]
      },
      "invocation_mode": "mutating",
      "profile": "zenchron-security-reviewer",
      "context_policy": "independent-review",
      "budget": {
        "max_execution_attempts": 1,
        "max_wall_seconds": 1800
      },
      "rationale": "EngineeringPolicy requires a security review independent of the material producer's vendor family."
    },
    {
      "id": "assurance",
      "kind": "assurance_gate",
      "depends_on": [
        "security-review"
      ],
      "required_claims": [
        "claim-tests"
      ],
      "rationale": "Satisfied from the existing evidence bundle; it creates no EngineeringRun."
    },
    {
      "id": "release-decision",
      "kind": "human_decision_gate",
      "depends_on": [
        "assurance"
      ],
      "required_claims": [
        "claim-human-approval"
      ],
      "action": {
        "type": "git.pull_request.create",
        "target": "acme/payments"
      },
      "rationale": "Publication remains an authority decision a person makes."
    }
  ],
  "provenance": {
    "compiler_version": "plan-compiler-v0.1",
    "project_model": {
      "id": "project-acme-payments",
      "revision": "1"
    },
    "policy": {
      "id": "policy-engineering-baseline",
      "revision": "1"
    },
    "contract": {
      "id": "contract-sso",
      "revision": "3"
    },
    "template": {
      "id": "security-sensitive-feature",
      "version": 1,
      "digest": "13c9b9b122628a11d0f4f321a92b049906d4ea44bac69ad4c16600f8727402cb"
    },
    "reasoning": {
      "agent_id": "claude",
      "provider_kind": "claude_code",
      "vendor_family": "anthropic",
      "trust_mode": "operator_trusted",
      "model": "sonnet",
      "invocation_mode": "non_mutating_planning",
      "provider_mode": "plan",
      "workspace_digest_before": "5a3f0f1f6b0e3a2d4c5b6a798899101112131415161718192021222324252627",
      "workspace_digest_after": "5a3f0f1f6b0e3a2d4c5b6a798899101112131415161718192021222324252627",
      "workspace_unchanged": true,
      "invocation": {
        "executable": "claude",
        "provider_version": "2.1.0 (Claude Code)",
        "permission_mode": "plan",
        "auth_mode": "local_cli_session",
        "auth_mode_source": "provider_state",
        "workspace_bound": false,
        "workspace_instructions_suppressed": true,
        "argv": ["--print", "--output-format", "stream-json", "--verbose", "--permission-mode", "plan", "[prompt]"],
        "prompt_sha256": "9f2c5a7e1b3d4c6e8f0a1b2c3d4e5f60718293a4b5c6d7e8f9a0b1c2d3e4f5a6",
        "execution_deadline": "2026-09-26T18:20:08Z",
        "execution_started_at": "2026-09-26T17:50:08Z",
        "execution_completed_at": "2026-09-26T17:52:41Z",
        "observed_wall_elapsed": 153000000000,
        "termination_cause": "provider_returned",
        "inactivity_limit": 600000000000,
        "progress_mode": "structured_claude_events",
        "structured_progress_events": 41,
        "final_result_observed": true,
        "permission_denials": 1,
        "permission_denied_tools": ["WebFetch"],
        "process_id": 48213,
        "git_guarded": true
      }
    },
    "previous_revision": 2,
    "proposal_id": "proposal-sso-002"
  }
}
